<?xml version="1.0" encoding="ISO-8859-1"?>
<input_definition xmlns:xsi="http://www.w3.org/2001/XMLSchema-instance" 
                      xsi:noNamespaceSchemaLocation="duck_schema.xsd">

    	<definition title="DUCK: Storage Integration Test"/>

    	<stream_definition>
		<stream stream_type="serial">
    			<serial_stream port_name="/dev/ttyUSB0" baud_rate="115200" data_bits="8" parity_bit="none" stop_bits="1"/>
		</stream>
		<acquisition_option acquisition_type="length"/>
    	</stream_definition>

	<message_description>    
		<data data_name="ascii message" data_len="10" data_type="int8" endianess="little-endian"/>
		<data data_name="non-ascii data" data_len="3" data_type="int32" endianess="little-endian"/>
		<data data_name="byte data" data_len="1" data_type="uint8" endianess="little-endian"/>
		<data data_name="byte array data" data_len="4" data_type="uint8" endianess="little-endian"/>
	</message_description>    

    <storage_description>

        <root_storage>
            <root_preset file_name="RootStorage_IntegrationTest_outfile.root"
                         gen_postproc_file="RootStorage_IntegrationTest_POST-PROCESSING.cpp"/>
            <data2storage data_name="ascii message"/>
            <data2storage data_name="non-ascii data"/>
            <data2storage data_name="byte data"/>
            <data2storage data_name="byte array data"/>
        </root_storage>

    </storage_description>
</input_definition>
